{
  "cases": [
    {
      "algorithm_family": "cryptography_stream_cipher",
      "alias": "chacha20_stream",
      "ast_structural_fingerprint": "89700df650ebee259a40005bdd032fa03c65b4826defd58b016fd11a6191ecf6",
      "case_id": "internal-app-045476f2e21d0fd8",
      "eligibility": "quarantine",
      "exclusion_reasons": [
        "license_or_checked_in_provenance_unresolved"
      ],
      "execution_contract": {
        "added_source_paths": [],
        "declared_top": null,
        "declared_top_found_in_added_source": null,
        "declared_top_matches_registry": null,
        "registered_source_declared": null,
        "status": "absent",
        "tcl_path": null
      },
      "history_future_partition": "history",
      "interface": {
        "call_name_count": 22,
        "top_lexically_found": true,
        "top_signature_sha256": "0c390d9a2f1cc7933059be2eb104e05a8e779f7af33b0186c0ecc82483acab1f"
      },
      "legacy_claim_refs": [],
      "legacy_info_label": "useful",
      "nearest_duplicate_refs": [],
      "normalized_token_sha256": "e7dbdb7dda6ce6e2f4fc11ff3ad5f46ca270cedc0bf187a46568c8d9968edb2a",
      "oracles": {
        "hidden": {
          "path": null,
          "present": false,
          "sha256": null
        },
        "independent_public_hidden_pair": false,
        "legacy_testbench": {
          "path": null,
          "present": false,
          "sha256": null
        },
        "public": {
          "path": null,
          "present": false,
          "sha256": null
        },
        "vitis_tcl": {
          "path": null,
          "present": false,
          "sha256": null
        }
      },
      "raw_source_baseline": {
        "evidence_ref": null,
        "status": "not_run"
      },
      "source_family": "app",
      "source_path": "src/app/libsodium/chacha20_stream.cpp",
      "source_sha256": "262b7034844bebac7adda219a66db30481ac21d23a59b57461c5889969f98d58",
      "top": "chacha20_encrypt_bytes",
      "upstream": {
        "admission": "quarantine",
        "checked_in_copy_matches_upstream_commit": "unverified",
        "checked_in_import_commit": "e3cb81b4ed53eec60fbf2cf5092267bda3882e82",
        "license": "NOASSERTION",
        "license_status": "unresolved_per_upstream_component",
        "upstream_commit": null,
        "upstream_path": null,
        "upstream_repo": null
      }
    },
    {
      "algorithm_family": "sequence_chaining",
      "alias": "mm_chain_dp_orig",
      "ast_structural_fingerprint": "f4e7fa44d7648a3eb67965bad33dd881f150981bf9436e5fa80cbc183956aa32",
      "case_id": "internal-app-3d666c0b2f30094e",
      "eligibility": "quarantine",
      "exclusion_reasons": [
        "vitis_tcl_execution_contract_inconsistent"
      ],
      "execution_contract": {
        "added_source_paths": [
          "src/app/minimap2/gemini_1.cpp"
        ],
        "declared_top": "mm_chain_dp_hls",
        "declared_top_found_in_added_source": false,
        "declared_top_matches_registry": false,
        "registered_source_declared": false,
        "status": "inconsistent",
        "tcl_path": "src/app/minimap2/vitis.tcl"
      },
      "history_future_partition": "history",
      "interface": {
        "call_name_count": 32,
        "top_lexically_found": true,
        "top_signature_sha256": "71eb56664608baafa4d15729962485b894323de6692c589b353f00a49af53c40"
      },
      "legacy_claim_refs": [
        "docs/results/ablation_tables.txt",
        "docs/results/coverage/summary.md"
      ],
      "legacy_info_label": "useful",
      "nearest_duplicate_refs": [],
      "normalized_token_sha256": "7cca4dbf5d9c05bb0b58c8460ed53173ba4871b3b83934749a3eff9e420a2557",
      "oracles": {
        "hidden": {
          "path": null,
          "present": false,
          "sha256": null
        },
        "independent_public_hidden_pair": false,
        "legacy_testbench": {
          "path": null,
          "present": false,
          "sha256": null
        },
        "public": {
          "path": null,
          "present": false,
          "sha256": null
        },
        "vitis_tcl": {
          "path": "src/app/minimap2/vitis.tcl",
          "present": true,
          "sha256": "5405d59abc33b62b2dec50b4f14d5380f0130b99f2507f69d6d62c24d6270b88"
        }
      },
      "raw_source_baseline": {
        "evidence_ref": null,
        "status": "not_run"
      },
      "source_family": "app",
      "source_path": "src/app/minimap2/mm_chain_dp_orig.cpp",
      "source_sha256": "5ad79fb64261db2f9e9daccae70d641e7131556e76270a8a8ea85abf3499ce3f",
      "top": "mm_chain_dp_orig",
      "upstream": {
        "admission": "quarantine",
        "checked_in_copy_matches_upstream_commit": "unverified",
        "checked_in_import_commit": "e3cb81b4ed53eec60fbf2cf5092267bda3882e82",
        "license": "NOASSERTION",
        "license_status": "unresolved_per_upstream_component",
        "upstream_commit": null,
        "upstream_path": null,
        "upstream_repo": null
      }
    },
    {
      "algorithm_family": "cryptography_hashing",
      "alias": "blake2b_compress",
      "ast_structural_fingerprint": "ee72f45e88e1dfc6b812a509c9ddb1302701832213ff026c2ae29a578964cb9d",
      "case_id": "internal-app-456706d81214aa75",
      "eligibility": "quarantine",
      "exclusion_reasons": [
        "license_or_checked_in_provenance_unresolved"
      ],
      "execution_contract": {
        "added_source_paths": [],
        "declared_top": null,
        "declared_top_found_in_added_source": null,
        "declared_top_matches_registry": null,
        "registered_source_declared": null,
        "status": "absent",
        "tcl_path": null
      },
      "history_future_partition": "future",
      "interface": {
        "call_name_count": 11,
        "top_lexically_found": true,
        "top_signature_sha256": "06352cbfd556d4807c3b3510a9f47a4705b9114f497d8ec6fca5859c6655e822"
      },
      "legacy_claim_refs": [],
      "legacy_info_label": "useful",
      "nearest_duplicate_refs": [],
      "normalized_token_sha256": "f28f826e0bc19eb2e01bf3200d9cfe130d2e98180ebc6cbb8d8a2ac563eb95bf",
      "oracles": {
        "hidden": {
          "path": null,
          "present": false,
          "sha256": null
        },
        "independent_public_hidden_pair": false,
        "legacy_testbench": {
          "path": null,
          "present": false,
          "sha256": null
        },
        "public": {
          "path": null,
          "present": false,
          "sha256": null
        },
        "vitis_tcl": {
          "path": null,
          "present": false,
          "sha256": null
        }
      },
      "raw_source_baseline": {
        "evidence_ref": null,
        "status": "not_run"
      },
      "source_family": "app",
      "source_path": "src/app/libsodium/blake2b_compress.cpp",
      "source_sha256": "32dd0fb488e9978504192c66fdb3ddb1f5a3468d2b3325f7393e1f9b4c5fef79",
      "top": "blake2b_compress",
      "upstream": {
        "admission": "quarantine",
        "checked_in_copy_matches_upstream_commit": "unverified",
        "checked_in_import_commit": "e3cb81b4ed53eec60fbf2cf5092267bda3882e82",
        "license": "NOASSERTION",
        "license_status": "unresolved_per_upstream_component",
        "upstream_commit": null,
        "upstream_path": null,
        "upstream_repo": null
      }
    },
    {
      "algorithm_family": "video_filtering",
      "alias": "av1_apply_temporal_filter",
      "ast_structural_fingerprint": "fe3babb9de92905054a771b9dcc7762c9e72699542134c3ec1908d317ac07c61",
      "case_id": "internal-app-4dce57fee93c76fa",
      "eligibility": "quarantine",
      "exclusion_reasons": [
        "license_or_checked_in_provenance_unresolved"
      ],
      "execution_contract": {
        "added_source_paths": [],
        "declared_top": null,
        "declared_top_found_in_added_source": null,
        "declared_top_matches_registry": null,
        "registered_source_declared": null,
        "status": "absent",
        "tcl_path": null
      },
      "history_future_partition": "future",
      "interface": {
        "call_name_count": 25,
        "top_lexically_found": true,
        "top_signature_sha256": "37152fe540edc92c9332769fe4205907f89b14848bc91cd67008599a2d6925d3"
      },
      "legacy_claim_refs": [],
      "legacy_info_label": "useful",
      "nearest_duplicate_refs": [],
      "normalized_token_sha256": "aa6fc057d760a2fd14e8b843282d959044e5fcf1dcf86ffa02eecf2cf955caf4",
      "oracles": {
        "hidden": {
          "path": null,
          "present": false,
          "sha256": null
        },
        "independent_public_hidden_pair": false,
        "legacy_testbench": {
          "path": null,
          "present": false,
          "sha256": null
        },
        "public": {
          "path": null,
          "present": false,
          "sha256": null
        },
        "vitis_tcl": {
          "path": null,
          "present": false,
          "sha256": null
        }
      },
      "raw_source_baseline": {
        "evidence_ref": null,
        "status": "not_run"
      },
      "source_family": "app",
      "source_path": "src/app/aom/av1_apply_temporal_filter.cpp",
      "source_sha256": "304da533efc66e8422280e279ddfc4250355e57816bc61eb5a2b6e9ca8484eb4",
      "top": "av1_apply_temporal_filter",
      "upstream": {
        "admission": "quarantine",
        "checked_in_copy_matches_upstream_commit": "unverified",
        "checked_in_import_commit": "e3cb81b4ed53eec60fbf2cf5092267bda3882e82",
        "license": "NOASSERTION",
        "license_status": "unresolved_per_upstream_component",
        "upstream_commit": null,
        "upstream_path": null,
        "upstream_repo": null
      }
    },
    {
      "algorithm_family": "video_rate_distortion",
      "alias": "av1_compound_type_rd",
      "ast_structural_fingerprint": "79f567c6e2cecf5737c2674341feb5dff1b5800c0c683840eb12469e65c5e1c2",
      "case_id": "internal-app-6350dc1f2eab6b4c",